<?xml version="1.0" encoding="UTF-8" ?>
<xs:schema xmlns:xs="http://www.w3.org/2001/XMLSchema" attributeFormDefault="unqualified" elementFormDefault="qualified">
    <xs:element name="allcontacts" type="allcontactsType"/>
    <xs:complexType name="contactType">
        <xs:sequence>
            <xs:element type="xs:string" name="firstname"/>
            <xs:element type="xs:string" name="lastname"/>
            <xs:element type="xs:string" name="email"/>
            <xs:element type="xs:string" name="country"/>
        </xs:sequence>
        <xs:attribute type="xs:string" name="id" use="required"/>
    </xs:complexType>
    <xs:complexType name="allcontactsType">
        <xs:sequence>
            <xs:element type="contactType" name="contact" maxOccurs="unbounded" minOccurs="0"/>
        </xs:sequence>
    </xs:complexType>
</xs:schema>